{
  "$ref": "#/definitions/blog",
  "definitions": {
    "blog": {
      "type": "object",
      "properties": {
        "title": {
          "type": "string"
        },
        "tag": {
          "type": "string"
        },
        "meta": {
          "type": "string"
        },
        "description": {
          "type": "string"
        },
        "category": {
          "type": "string",
          "enum": [
            "academic",
            "training",
            "travel"
          ]
        },
        "links": {
          "type": "array",
          "items": {
            "type": "object",
            "properties": {
              "label": {
                "type": "string"
              },
              "url": {
                "type": "string"
              },
              "icon": {
                "type": "string"
              },
              "disabled": {
                "type": "boolean"
              },
              "class": {
                "type": "string"
              }
            },
            "required": [
              "label",
              "url"
            ],
            "additionalProperties": false
          }
        },
        "$schema": {
          "type": "string"
        }
      },
      "required": [
        "title",
        "tag",
        "description",
        "category"
      ],
      "additionalProperties": false
    }
  },
  "$schema": "http://json-schema.org/draft-07/schema#"
}