{
  "title": "6-dages split: fordele, faldgruber og hvordan man undgår overbelastning",
  "tag": "Træning",
  "meta": "— · —",
  "description": "Når volumen er høj, er restitution en “feature”, ikke en bonus. Her er de greb der gør split’et bæredygtigt.",
  "links": [
    {
      "label": "Læs mere",
      "url": "#",
      "disabled": true,
      "class": "btn ghost"
    }
  ],
  "category": "training"
}