{
  "title": "Camino: hvad jeg ville ønske jeg vidste før første lange dag",
  "tag": "Rejser",
  "meta": "— · —",
  "description": "De små ting: tempo, pauser, sokker, “ego-management” og hvorfor dag 3 ofte føles hårdere end dag 1.",
  "links": [
    {
      "label": "Læs mere",
      "url": "#",
      "disabled": true,
      "class": "btn ghost"
    }
  ],
  "category": "travel"
}