{
  "title": "Blogindlæg Titel 1",
  "tag": "Fagligt",
  "meta": "20. august 2024 · 5 min læsning",
  "description": "Introducerende uddrag… Skriv gerne hvad læseren får ud af indlægget i én sætning.",
  "links": [
    {
      "label": "Læs mere",
      "url": "#",
      "disabled": true,
      "class": "btn ghost"
    }
  ],
  "category": "academic"
}