{
  "title": "Træningsstatistik (dashboard)",
  "tag": "Træning",
  "meta": "Opdateres løbende · Volumen · Top sæt · Est. 1RM · Plateau-watch",
  "description": "Jeg logger mine sessions (PUSH/PULL/LEGS) og opsummerer nøgletal som tonnage, reps og bedste sæt. Siden er lavet til et stabilt program, så udvikling og plateaus er nemme at spotte.",
  "links": [
    {
      "label": "Åbn træningsstatistik",
      "url": "/traeningsstatistik",
      "icon": "fa-solid fa-chart-line",
      "class": "btn"
    },
    {
      "label": "Tilbage til træning",
      "url": "#cat-traening",
      "class": "btn ghost"
    }
  ],
  "category": "training"
}