{
  "title": "Min simple måde at tracke progression på (uden at miste hovedet)",
  "tag": "Træning",
  "meta": "— · —",
  "description": "Et realistisk system: få nøgletal (volumen, RPE/indsats, søvn), og evaluer uge for uge – ikke dag for dag.",
  "links": [
    {
      "label": "Læs mere",
      "url": "#",
      "disabled": true,
      "class": "btn ghost"
    }
  ],
  "category": "training"
}