{
  "title": "Hvordan jeg planlægger en rute uden at over-planlægge",
  "tag": "Rejser",
  "meta": "— · —",
  "description": "En robust plan med plads til virkeligheden: energi, vejr, ben, og det man ikke kan forudsige.",
  "links": [
    {
      "label": "Læs mere",
      "url": "#",
      "disabled": true,
      "class": "btn ghost"
    }
  ],
  "category": "travel"
}