{
  "title": "Mine favoritcitater",
  "tag": "Noter",
  "meta": "Opdateres løbende · Disciplin · Læring · Tro · Humor",
  "description": "Korte linjer jeg vender tilbage til. Med tema-tags og søgning, så jeg faktisk kan finde dem igen.",
  "links": [
    {
      "label": "Åbn citater",
      "url": "/quotes",
      "icon": "fa-solid fa-quote-left",
      "class": "btn"
    },
    {
      "label": "Tilbage til blog",
      "url": "#cat-fagligt",
      "class": "btn ghost"
    }
  ],
  "category": "academic"
}