{
  "title": "Rejsekort (interaktivt)",
  "tag": "Rejser",
  "meta": "Opdateres løbende · Ruter · Byer · Vandringer",
  "description": "Interaktivt kort med steder jeg har været — med noter og highlights fra ture, ruter og små erfaringer undervejs.",
  "links": [
    {
      "label": "Åbn rejsekort",
      "url": "/map",
      "icon": "fa-solid fa-map-location-dot",
      "class": "btn"
    },
    {
      "label": "Tilbage til rejser",
      "url": "#cat-rejser",
      "class": "btn ghost"
    }
  ],
  "category": "travel"
}