{
  "title": "Vandring: min pakkeliste (det essentielle + det jeg droppede)",
  "tag": "Rejser",
  "meta": "— · —",
  "description": "Let og praktisk: det du bruger hver dag, og det du bærer uden grund. Plus små hacks, der redder fødderne.",
  "links": [
    {
      "label": "Læs mere",
      "url": "#",
      "disabled": true,
      "class": "btn ghost"
    }
  ],
  "category": "travel"
}